{
  "schemaVersion": 1,
  "id": "enterprise-current-official-name-evidence",
  "version": "2026.10.25.2",
  "asOf": "2026-10-25",
  "regime": "Enterprise",
  "legalStatus": "OfficialCurrent",
  "scope": "执行企业会计准则的非金融企业，已执行新金融/收入/租赁准则且未采用2026CAS30。仅25个正式附件具名科目元数据，不是官方全量科目表，不生成可记账数字编码。",
  "isCompleteCurrentChart": false,
  "isVerifiedForProduction": false,
  "verifiedNumericCodeCount": 0,
  "officialNameCount": 25,
  "sourceRefs": [
    {
      "sourceId": "enterprise-reports",
      "locator": "正式附件2具名科目与适用范围"
    },
    {
      "sourceId": "enterprise-guide-access",
      "locator": "完整现行应用指南为出版物，尚未取得"
    }
  ],
  "namedAccounts": [
    {
      "semanticId": "ent-name-receivable",
      "name": "应收账款",
      "accountCode": null,
      "numericCodeVerification": "NotObtainedFromOfficialCurrentGuide",
      "evidenceType": "AccountNameExplicitlyMentionedInFormalReportInstructions",
      "sourceRefs": [
        {
          "sourceId": "enterprise-reports",
          "locator": "PDF第3页；资产负债表编制说明第3项"
        }
      ],
      "normalDirection": null,
      "normalDirectionVerification": "NotEstablishedByThisNameEvidence",
      "isCompleteCurrentChart": false
    },
    {
      "semanticId": "ent-name-bad-debt-allowance",
      "name": "坏账准备",
      "accountCode": null,
      "numericCodeVerification": "NotObtainedFromOfficialCurrentGuide",
      "evidenceType": "AccountNameExplicitlyMentionedInFormalReportInstructions",
      "sourceRefs": [
        {
          "sourceId": "enterprise-reports",
          "locator": "PDF第3页；资产负债表编制说明第2—3项"
        }
      ],
      "normalDirection": null,
      "normalDirectionVerification": "NotEstablishedByThisNameEvidence",
      "isCompleteCurrentChart": false
    },
    {
      "semanticId": "ent-name-debt-investment",
      "name": "债权投资",
      "accountCode": null,
      "numericCodeVerification": "NotObtainedFromOfficialCurrentGuide",
      "evidenceType": "AccountNameExplicitlyMentionedInFormalReportInstructions",
      "sourceRefs": [
        {
          "sourceId": "enterprise-reports",
          "locator": "PDF第4页；资产负债表编制说明第7项"
        }
      ],
      "normalDirection": null,
      "normalDirectionVerification": "NotEstablishedByThisNameEvidence",
      "isCompleteCurrentChart": false
    },
    {
      "semanticId": "ent-name-debt-investment-allowance",
      "name": "债权投资减值准备",
      "accountCode": null,
      "numericCodeVerification": "NotObtainedFromOfficialCurrentGuide",
      "evidenceType": "AccountNameExplicitlyMentionedInFormalReportInstructions",
      "sourceRefs": [
        {
          "sourceId": "enterprise-reports",
          "locator": "PDF第4页；资产负债表编制说明第7项"
        }
      ],
      "normalDirection": null,
      "normalDirectionVerification": "NotEstablishedByThisNameEvidence",
      "isCompleteCurrentChart": false
    },
    {
      "semanticId": "ent-name-other-debt-investment",
      "name": "其他债权投资",
      "accountCode": null,
      "numericCodeVerification": "NotObtainedFromOfficialCurrentGuide",
      "evidenceType": "AccountNameExplicitlyMentionedInFormalReportInstructions",
      "sourceRefs": [
        {
          "sourceId": "enterprise-reports",
          "locator": "PDF第4、5页；资产负债表编制说明第8项"
        }
      ],
      "normalDirection": null,
      "normalDirectionVerification": "NotEstablishedByThisNameEvidence",
      "isCompleteCurrentChart": false
    },
    {
      "semanticId": "ent-name-other-equity-instrument-investment",
      "name": "其他权益工具投资",
      "accountCode": null,
      "numericCodeVerification": "NotObtainedFromOfficialCurrentGuide",
      "evidenceType": "AccountNameExplicitlyMentionedInFormalReportInstructions",
      "sourceRefs": [
        {
          "sourceId": "enterprise-reports",
          "locator": "PDF第5页；资产负债表编制说明第9项"
        }
      ],
      "normalDirection": null,
      "normalDirectionVerification": "NotEstablishedByThisNameEvidence",
      "isCompleteCurrentChart": false
    },
    {
      "semanticId": "ent-name-fixed-asset",
      "name": "固定资产",
      "accountCode": null,
      "numericCodeVerification": "NotObtainedFromOfficialCurrentGuide",
      "evidenceType": "AccountNameExplicitlyMentionedInFormalReportInstructions",
      "sourceRefs": [
        {
          "sourceId": "enterprise-reports",
          "locator": "PDF第5页；资产负债表编制说明第10项"
        }
      ],
      "normalDirection": null,
      "normalDirectionVerification": "NotEstablishedByThisNameEvidence",
      "isCompleteCurrentChart": false
    },
    {
      "semanticId": "ent-name-fixed-depreciation",
      "name": "累计折旧",
      "accountCode": null,
      "numericCodeVerification": "NotObtainedFromOfficialCurrentGuide",
      "evidenceType": "AccountNameExplicitlyMentionedInFormalReportInstructions",
      "sourceRefs": [
        {
          "sourceId": "enterprise-reports",
          "locator": "PDF第5页；资产负债表编制说明第10项"
        }
      ],
      "normalDirection": null,
      "normalDirectionVerification": "NotEstablishedByThisNameEvidence",
      "isCompleteCurrentChart": false
    },
    {
      "semanticId": "ent-name-fixed-impairment",
      "name": "固定资产减值准备",
      "accountCode": null,
      "numericCodeVerification": "NotObtainedFromOfficialCurrentGuide",
      "evidenceType": "AccountNameExplicitlyMentionedInFormalReportInstructions",
      "sourceRefs": [
        {
          "sourceId": "enterprise-reports",
          "locator": "PDF第5页；资产负债表编制说明第10项"
        }
      ],
      "normalDirection": null,
      "normalDirectionVerification": "NotEstablishedByThisNameEvidence",
      "isCompleteCurrentChart": false
    },
    {
      "semanticId": "ent-name-fixed-disposal",
      "name": "固定资产清理",
      "accountCode": null,
      "numericCodeVerification": "NotObtainedFromOfficialCurrentGuide",
      "evidenceType": "AccountNameExplicitlyMentionedInFormalReportInstructions",
      "sourceRefs": [
        {
          "sourceId": "enterprise-reports",
          "locator": "PDF第5页；资产负债表编制说明第10项"
        }
      ],
      "normalDirection": null,
      "normalDirectionVerification": "NotEstablishedByThisNameEvidence",
      "isCompleteCurrentChart": false
    },
    {
      "semanticId": "ent-name-right-of-use-asset",
      "name": "使用权资产",
      "accountCode": null,
      "numericCodeVerification": "NotObtainedFromOfficialCurrentGuide",
      "evidenceType": "AccountNameExplicitlyMentionedInFormalReportInstructions",
      "sourceRefs": [
        {
          "sourceId": "enterprise-reports",
          "locator": "PDF第5、6页；资产负债表编制说明第12项"
        }
      ],
      "normalDirection": null,
      "normalDirectionVerification": "NotEstablishedByThisNameEvidence",
      "isCompleteCurrentChart": false
    },
    {
      "semanticId": "ent-name-right-of-use-depreciation",
      "name": "使用权资产累计折旧",
      "accountCode": null,
      "numericCodeVerification": "NotObtainedFromOfficialCurrentGuide",
      "evidenceType": "AccountNameExplicitlyMentionedInFormalReportInstructions",
      "sourceRefs": [
        {
          "sourceId": "enterprise-reports",
          "locator": "PDF第6页；资产负债表编制说明第12项"
        }
      ],
      "normalDirection": null,
      "normalDirectionVerification": "NotEstablishedByThisNameEvidence",
      "isCompleteCurrentChart": false
    },
    {
      "semanticId": "ent-name-right-of-use-impairment",
      "name": "使用权资产减值准备",
      "accountCode": null,
      "numericCodeVerification": "NotObtainedFromOfficialCurrentGuide",
      "evidenceType": "AccountNameExplicitlyMentionedInFormalReportInstructions",
      "sourceRefs": [
        {
          "sourceId": "enterprise-reports",
          "locator": "PDF第6页；资产负债表编制说明第12项"
        }
      ],
      "normalDirection": null,
      "normalDirectionVerification": "NotEstablishedByThisNameEvidence",
      "isCompleteCurrentChart": false
    },
    {
      "semanticId": "ent-name-lease-liability",
      "name": "租赁负债",
      "accountCode": null,
      "numericCodeVerification": "NotObtainedFromOfficialCurrentGuide",
      "evidenceType": "AccountNameExplicitlyMentionedInFormalReportInstructions",
      "sourceRefs": [
        {
          "sourceId": "enterprise-reports",
          "locator": "PDF第7页；资产负债表编制说明第19项"
        }
      ],
      "normalDirection": null,
      "normalDirectionVerification": "NotEstablishedByThisNameEvidence",
      "isCompleteCurrentChart": false
    },
    {
      "semanticId": "ent-name-contract-asset",
      "name": "合同资产",
      "accountCode": null,
      "numericCodeVerification": "NotObtainedFromOfficialCurrentGuide",
      "evidenceType": "AccountNameExplicitlyMentionedInFormalReportInstructions",
      "sourceRefs": [
        {
          "sourceId": "enterprise-reports",
          "locator": "PDF第8页；资产负债表编制说明第22项"
        }
      ],
      "normalDirection": null,
      "normalDirectionVerification": "NotEstablishedByThisNameEvidence",
      "isCompleteCurrentChart": false
    },
    {
      "semanticId": "ent-name-contract-liability",
      "name": "合同负债",
      "accountCode": null,
      "numericCodeVerification": "NotObtainedFromOfficialCurrentGuide",
      "evidenceType": "AccountNameExplicitlyMentionedInFormalReportInstructions",
      "sourceRefs": [
        {
          "sourceId": "enterprise-reports",
          "locator": "PDF第8页；资产负债表编制说明第22项"
        }
      ],
      "normalDirection": null,
      "normalDirectionVerification": "NotEstablishedByThisNameEvidence",
      "isCompleteCurrentChart": false
    },
    {
      "semanticId": "ent-name-contract-asset-allowance",
      "name": "合同资产减值准备",
      "accountCode": null,
      "numericCodeVerification": "NotObtainedFromOfficialCurrentGuide",
      "evidenceType": "AccountNameExplicitlyMentionedInFormalReportInstructions",
      "sourceRefs": [
        {
          "sourceId": "enterprise-reports",
          "locator": "PDF第8页；资产负债表编制说明第22项"
        }
      ],
      "normalDirection": null,
      "normalDirectionVerification": "NotEstablishedByThisNameEvidence",
      "isCompleteCurrentChart": false